Index,URL,Type,Name,Description,Street Address,City,Region,Postal Code,Country,Telephone,Website,Google Maps URL
470,https://www.discoverpuertorico.com/profile/la-casa-hamaca/14678,Hotel,La Casa Hamaca,"Welcome to this stunning vacation house, a perfect retreat for families and large groups seeking a memorable getaway. Nestled just a minute's walk away from the beach, this private oasis offers an abundance of amenities and spaciousness for a comfortable and enjoyable stay. This two-story house boasts five tastefully designed bedrooms, providing ample accommodation for everyone. Each bedroom is thoughtfully furnished with cozy beds, ensuring a restful night's sleep. With three well-appointed bathrooms, there is no shortage of convenience and privacy for all guests.","Carr 441, Km 2.6 Aguada, PR",Aguada,West,602,USA,(813) 410-1437,https://www.stayriserentals.com/la-casa-hamaca-en-aguada-orp5b4e4e6x,"https://www.google.com/maps/search/?api=1&query_place_id=ChIJKadheCa7AowREY1kQdcobsQ&query=18.3998455000,-67.1860647000"
471,https://www.discoverpuertorico.com/profile/casa-tortuga/14679,Hotel,Casa Tortuga,"Welcome to our vacation villa nestled within a beachfront condominium in a quiet and secluded neighborhood. This charming getaway offers a serene and tranquil atmosphere, with a private and secluded beach entrance just a short walk away. Located within a gated community, this villa provides a sense of security and exclusivity. As you enter the property, you'll be greeted by lush tropical surroundings and a warm and inviting ambiance.","Carr 441, Km 2.7 A",Aguada,West,602,USA,(813) 410-1437,https://www.stayriserentals.com/casa-tortuga-at-aguada-sea-beach-orp5b4a4cdx,"https://www.google.com/maps/search/?api=1&query_place_id=https://g.page/casa-tortuga-at-aguada-sea-beach?share&query=18.3998455000,-67.1860647000"
472,https://www.discoverpuertorico.com/profile/casa-marlin/14680,Hotel,Casa Marlin,"Welcome to our exquisite villa nestled within a beachfront condominium, offering an ideal getaway for couples or small families seeking a romantic and intimate vacation. Located within a gated community, this villa guarantees privacy and exclusivity. As you step into the villa, you'll be greeted by a tastefully decorated living space that exudes elegance and charm. The villa is thoughtfully designed to provide a cozy and romantic atmosphere, perfect for creating lasting memories.","Carr 441, Km 2.7",Aguada,West,602,USA,(813) 410-1437,https://www.stayriserentals.com/casa-marlin-at-aguada-sea-beach-orp5b4b6ffx,"https://www.google.com/maps/search/?api=1&query=18.3998455000,-67.1860647000"
473,https://www.discoverpuertorico.com/profile/villa-sirena/14681,Hotel,Villa Sirena,"Villa Sirena by Buyé Beach is a picturesque and charming vacation retreat that offers a perfect blend of romance and family-friendly amenities, including a pool, backup power, and a water reserve tank. Nestled in a lush, tropical paradise on the western coast of Puerto Rico, this villa promises a memorable escape by the crystal-clear waters of Buyé Beach.","Carr 307, km 4.8 Cabo Rojo, PR",Cabo Rojo,West,623,USA,(813) 410-1437,https://www.stayriserentals.com/villa-sirena-buy%c3%a9-orp5b4d2a7x,"https://www.google.com/maps/search/?api=1&query_place_id=ChIJM6VszYhRHYwRK7r9K1htceY&query=18.0866265000,-67.1457347000"
474,https://www.discoverpuertorico.com/profile/villa-tucan/14682,Hotel,Villa Tucan,"Villa Tucan is a secluded villa at Chalet De Buyé in Cabo Rojo, Puerto Rico, is a short walk to Buyé beach. Cool off in the pool or retreat in a brand-new villa that sleeps 4 in two plush queen beds. Unwind in the A/C in your beautiful, decorated unit. Cook on the BBQ grill or your fully equipped kitchen. You are a short drive to local restaurants and attractions of Cabo Rojo. Villa Tucan is designed to be your home away from home. Your villa has a generator and reserve water.","Carr 307, km 4.8",Cabo Rojo,West,603,USA,(813) 410-1437,https://www.stayriserentals.com/villa-tucan-buy%c3%a9-orp5b4d2b4x,"https://www.google.com/maps/search/?api=1&query=18.0866265000,-67.1457347000"
475,https://www.discoverpuertorico.com/profile/villa-flamingo-buye/14683,Hotel,Villa Flamingo Buyé,"Villa Flamingo is a secluded villa at Chalet De Buyé in Cabo Rojo, Puerto Rico that, is a short walk to Buyé beach. Cool off in the pool or retreat in a brand-new villa that sleeps 4 in two plush queen beds. Unwind in the A/C in your beautiful, decorated unit. Cook on the BBQ grill, or your fully equipped kitchen. You are a short drive to local restaurants and attractions of Cabo Rojo. Villa Flamingo is designed to be your home away from home. Your villa has a generator and reserve water.","Carr 307, km 4.8",Cabo Rojo,West,603,USA,(813) 410-1437,https://www.stayriserentals.com/villa-flamingo-buy%c3%a9-orp5b4d2b5x,"https://www.google.com/maps/search/?api=1&query_place_id=ChIJtaPJ74lNHYwRrXepOqBbo4s&query=18.0866265000,-67.1457347000"
476,https://www.discoverpuertorico.com/profile/villa-coqui/14684,Hotel,Villa Coqui,"Villa Coqui is a secluded villa that is a short walk to Buyé beach. Cool off in the pool or retreat in a brand-new villa that sleeps 4 in two plush queen beds. Unwind in the A/C in our beautifully decorated unit. Cook in your fully equipped kitchen, or you are a short drive to local restaurants. Your villa has a generator and reserve water. Cabo Rojo is located in the extreme southwest of Puerto Rico, where charms include towering limestone cliffs, stunning beaches, nature reserves, and creative restaurants.","Carr 307, km 4.8",Cabo Rojo,West,603,USA,(813) 410-1437,https://www.stayriserentals.com/villa-coqu%c3%ad-buy%c3%a9-orp5b4d2b3x,"https://www.google.com/maps/search/?api=1&query_place_id=ChIJX1JZ5SlNHYwRDoedvwyzs9k&query=18.0866265000,-67.1457347000"
477,https://www.discoverpuertorico.com/profile/capri-beach-house-dorado/14707,Hotel,"Capri Beach House, Dorado","Capri Beach House Dorado is a unique and exclusive retreat just steps from beautiful Breñas Beach, with a kid friendly pool and pickle ball court. It is located in a private community right next to the Dorado Beach Ritz. With spacious living quarters and five (5) bedrooms that sleep 10, the house is well appointed with comfortable mattresses, soft towels and everything you might want in the kitchen. It is the perfect getaway for family reunions and friends.",23-A Breñas Estates,Dorado,North,646,USA,(787) 505-8344,https://capribeachhousedorado.com/,"https://www.google.com/maps/search/?api=1&query=18.4710581000,-66.3159738000"
478,https://www.discoverpuertorico.com/profile/don-rafa-boutique-hotel-residences/14719,Hotel,Don Rafa Boutique Hotel & Residences,"Inspired by the 1950’s ambiance, Don Rafa Boutique Hotel and Residences is where essence and nostalgia meet to elevate your experience through carefully curated details and personal attention that embraces visitors like family. Discover your perfect space to stay among the 36 unique options our architectonic jewel building offers. No matter your choosing, an eclectic mid-century modern style décor, and polished antique accents will provide an intimate and classy lodging. Located at the heart of the historic district of Miramar, you can experience city life.",601 Miramar Avenue,San Juan,Metro,907,USA,(787) 303-3350,http://www.donrafaboutiquehotel.com,"https://www.google.com/maps/search/?api=1&query=18.4563310000,-66.0849064000"
479,https://www.discoverpuertorico.com/profile/dorado-beach-villas-rentals/14724,Hotel,Dorado Beach Villas Rentals,"Your 24-hr hospitality and expert villa rental resource- with Alma Bair, G.M. at your service. We focus on all aspects of your vacation experience to make it extraordinary. The beach communities in Dorado offer beautiful, golden-sand-warm-water beaches, with a range of activities and amenities – world-class restaurants – famous golf courses – and more. Paradise Villas & Vacations brings unparalleled, 5-Star concierge-style, 24/7 guest services.",Dorado PR,Dorado,North,646,USA,508-359-7013,http://www.paradisevillapr.com,"https://www.google.com/maps/search/?api=1&query=18.4626615000,-66.2701404000"
480,https://www.discoverpuertorico.com/profile/la-casita-en-rio-grande/14755,Hotel,La Casita en Río Grande,"Hello nature lovers! Would you like to stay in a private property surrounded by 8 acres of Rainforest and exclusive access to your spot on the river? The property is located within the El Yunque Rainforest, and the river is unbelievably beautiful and peaceful. The home has an outdoor fire pit to sit under the moon and listen to the sounds of the Rainforest, or you can dine outside under a beautiful pergola and enjoy the night sky. You will love this natural retreat!",PR-966,Río Grande,East,745,USA,,https://riogrande.guestybookings.com/properties/66c8bfca2a46e30010a2b45d,"https://www.google.com/maps/search/?api=1&query=18.3376932000,-65.7996441000"
481,https://www.discoverpuertorico.com/profile/crabs-island-adventures-llc/14757,Hotel,"Crabs Island Adventures, LLC","Crab Island Adventures is a Vieques-based accommodations provider where you can comfortably find lodging for your stay in Vieques. Your 4-day, 3-night stay tack on with a car. No need to go anywhere to reserve a vehicle, and you can tack on with the apartment to make your arrival easier. Also, our host can help you book various adventures around the island ahead of time with several local companies that we are sponsored. You choose what adventure you want to explore, and we make sure you have fun.",PR-201 Bo Florida,Vieques,Culebra & Vieques,765,USA,(787) 608-8983,https://mycrabislandadventures.com/,"https://www.google.com/maps/search/?api=1&query=18.1311598000,-65.4919242000"
482,https://www.discoverpuertorico.com/profile/madre-tierra-glamping/14812,Hotel,Madre Tierra Glamping,"Madre Tierra Glamping is a beautiful ecological project in the capital of tourism, Cabo Rojo, Puerto Rico. At the Island's southwest corner, we are surrounded by tourist areas, beautiful beaches, and the best sunsets in Puerto Rico. We have four unique bubbles named after our first inhabitants, the Taínos. The bubbles are in a mountainous area, isolated from the noise and the rush of daily life but close to the tourist areas. It is a relaxing environment surrounded by nature and full of luxuries inside the bubble room. Common areas are designed for everyone to enjoy, not just couples.",Camino el Zapato Bo. Las Palmas,Cabo Rojo,West,623,USA,(787) 604-9696,https://madretierraglamping.com/,"https://www.google.com/maps/search/?api=1&query=18.0113346000,-67.1196011000"
483,https://www.discoverpuertorico.com/profile/villa-mariede-pr/14794,Hotel,Villa Mariede PR,"Villa Mariede is a modern and cozy apartment with three bedrooms, two bathrooms, parking, a living room, a dining room, a kitchen, and a balcony with a hammock to enjoy the view of El Yunque National Park. It is located in a private apartment complex with a swimming pool, jacuzzi, and gazebo. Near El Yunque Rainforest, Hacienda Carabalí, Luquillo, Bioluminescent Bay and the Outlets Mall.",Urb. River Plantation,Canóvanas,East,729,USA,(787) 642-3123,https://www.airbnb.com/rooms/53507623?source_impression_id=p3_1673546879_0fK3rMBJUwDiP1Pt,"https://www.google.com/maps/search/?api=1&query=18.3753858000,-65.8908483000"
484,https://www.discoverpuertorico.com/profile/tropical-breeze-vacation-rentals/14816,Hotel,Tropical Breeze Vacation Rentals,We are a vacation rental service located in the East of Puerto Rico.,Calle Delfin #134,Fajardo,East,738,USA,(787) 534-4407,https://www.tropicalbreezescapes.com/?fbclid=IwAR2JsUUxVHLA6FugVFQoIwCtV1jkbqSrO-WBzJ8d1WD0tE3pX2KgDD05vL8,"https://www.google.com/maps/search/?api=1&query=18.3650131000,-65.6338002000"
487,https://www.discoverpuertorico.com/profile/aibonito-hotel/14905,Hotel,Aibonito Hotel,Come visit us in Aibonito and enjoy the best that our town brings you with us.,"Carr. 14, Km 48.9 Bo. Asomante",Aibonito,Central Mountains,705,USA,(787) 705-4435,https://www.thisisitpuertorico.com/aibonito-lodging,"https://www.google.com/maps/search/?api=1&query_place_id=https://www.google.com/maps/place/Aibonito+Hotel/@18.1339602,-66.2760193,17z/data=!3m1!4b1!4m6!3m5!1s0x8c033743e992b661:0xa1074cf49e4641c0!8m2!3d18.1339602!4d-66.2738306!16s%2Fg%2F11g0t6vg63?hl=es-419&query=18.0783629000,-66.3619807000"
488,https://www.discoverpuertorico.com/profile/boulevard-park-iv/14906,Hotel,Boulevard Park IV,"Apartments for Vacation Rental in Mayagüez Downtown, with access to main roads and more. Class, elegance and good taste are definitely the main characteristics that make our apartments unique in their class. This results in added value, since its distribution allows you to have space for 8 people in the same apartment. All these elements definitely make us feel that we have to offer you a unique alternative in Mayagüez!","35 Calle Alemañy, Esq Arroyo Mestre",Mayagüez,West,682,USA,(787) 705-4435,https://www.thisisitpuertorico.com/mayaguez-lodging,"https://www.google.com/maps/search/?api=1&query_place_id=https://www.google.com/maps/place/Boulevard+Park+IV/@18.1932679,-67.1432436,17z/data=!3m1!4b1!4m9!3m8!1s0x8c02b3b2b9d7af97:0xba1f868c2736d91e!5m2!4m1!1i2!8m2!3d18.1932679!4d-67.1410549!16s%2Fg%2F11f5lyctq1?hl=es-419&query=18.1933339000,-67.1410732000"
489,https://www.discoverpuertorico.com/profile/casa-del-campo-en-adjuntas/14907,Hotel,Casa del Campo en Adjuntas,"Casa del Campo offers a unique experience by being submerged in the Adjuntas Mountain. Casa de Campo provides you with the necessary comforts. Delicacy and comfort are our first selection. Casa del Campo includes: night table with lamp, closet, armchair, TV with ROKU system, table and iron, internet, It has 3 rooms with Queen Beds with capacity for 8 people including a sofa bed. Private bathroom with its amenities (soap, shampoo, lotion, etc.) and includes towels and bed linen.","Parcela B-8, Carr 135 km 17.2 Interior, Bo. Yayales",Adjuntas,Central Mountains,601,USA,(787) 705-4435,https://www.thisisitpuertorico.com/adjuntas-lodging,"https://www.google.com/maps/search/?api=1&query=18.1889554000,-66.7708149000"
490,https://www.discoverpuertorico.com/profile/casa-del-lago/14908,Hotel,Casa del Lago,"Venture through Adjuntas staying with us at Casa del Lago, in front of Lake Garzas.",Barrio Garzas Carr PR-518 KM 8.35 Intersección Carr- 522,Adjuntas,Central Mountains,601,USA,(787) 705-4435,https://www.thisisitpuertorico.com/adjuntas-lodging,"https://www.google.com/maps/search/?api=1&query_place_id=https://www.google.com/maps/place/Casa+del+Lago+en+Adjuntas/@18.1413485,-66.7451222,17z/data=!3m1!4b1!4m6!3m5!1s0x8c02d387ecf7439f:0xdb73e0509decae0!8m2!3d18.1413485!4d-66.7429282!16s%2Fg%2F11rcb8kl8v?hl=es-419&query=18.1419437000,-66.7439886000"
491,https://www.discoverpuertorico.com/profile/chandelier/14909,Hotel,Chandelier,"Vacation Apartments in Ponce, fully equipped, furnished and with a pool. Strategically located in the center of the city of Ponce, this apartment/studio offers you the opportunity to enjoy the colonial architecture of the area and the day and night life of the city. This elegant apartment is fully equipped and furnished, with a Queen Size bed (2 people) + Queen Size Sofa bed (2 people), which allows to easily accommodate 4 people per apartment. It also includes sheets, covers, friezes and pillows.","26 Calle Sol, Ponce,",Ponce,South,730,USA,(787) 705-4435,https://www.thisisitpuertorico.com/ponce-lodging,"https://www.google.com/maps/search/?api=1&query_place_id=https://www.google.com/maps/place/Edificio+Chandelier/@18.0137917,-66.6129076,17z/data=!3m1!4b1!4m6!3m5!1s0x8c1cd58d16c6396f:0x608d5000a4d9d71e!8m2!3d18.0137917!4d-66.6107189!16s%2Fg%2F11g0lv3rs2?hl=es-419&query=18.0138739000,-66.6106916000"
492,https://www.discoverpuertorico.com/profile/edificios-gladiolas/14910,Hotel,Edificios Gladiolas,"Apartments part of This is it Puerto Rico, Gladiolas offers you a cozy, fresh, modern and elegant space. Strategically located in the center of the city of Ponce, this apartment/studio offers you the opportunity to enjoy the colonial architecture of the area and all the active daily and nightlife of the city. This elegant apartment is fully equipped and furnished, with a maximum accommodation capacity of up to 10 people. With apartments from 1 to 4 rooms with sofa bed and futon, in order to accommodate a greater capacity and comfort within it.","119 Calle Villa, Ponce,",Ponce,South,730,USA,(787) 705-4435,https://www.thisisitpuertorico.com/ponce-lodging,"https://www.google.com/maps/search/?api=1&query_place_id=https://www.google.com/maps/place/Edificios+Gladiolas/@18.0108185,-66.6168994,17z/data=!3m1!4b1!4m6!3m5!1s0x8c1cd531f5c5c587:0xe439a8a6709c7d59!8m2!3d18.0108185!4d-66.6147107!16s%2Fg%2F11f6dkn_2j?hl=es-419&query=18.0108558000,-66.6146683000"
493,https://www.discoverpuertorico.com/profile/la-view-magic-mountain/14914,Hotel,La View Magic Mountain,"""The View Magic Mountain is a small private paradise for you and your partner—a spectacular view at more than 1,850 feet above sea level. You can see from the Atlantic Ocean to Los Picos del Yunque on a clear day—where the Temperature is part of this cozy place. You can enjoy romantic moments with your partner in the moonlight while sharing a relaxing hot water jacuzzi. We have carefully prepared a clean, private, and cozy place for our guests. Exclusive parking and private.","Barrio Beatriz, Sector Las Piñas 111",San Juan,Metro,927,USA,(787) 603-1089,,"https://www.google.com/maps/search/?api=1&query=18.4670588000,-66.1184593000"
494,https://www.discoverpuertorico.com/profile/coqui-beach-rentals/15927,Hotel,Coqui Beach Rentals,"At Coqui Beach Rentals, we exist solely to provide memorable vacation homes in the beautiful island of Puerto Rico. This because, we believe that memorable vacations start with memorable homes. To accomplish this, we partner with select hosts to ensure the best hospitality experiences through innovative hosting and hospitality solutions. Check out our listings! When booking through our webpage, use code DISCOVERPR for discounted rate.",Cond. Aquatika,Loíza,East,972,USA,(571) 279-8189,https://coquibeachrentals.com/,"https://www.google.com/maps/search/?api=1&query=18.4243400000,-65.8386473000"
495,https://www.discoverpuertorico.com/profile/panoramic-beach-view-culebra-apt/15985,Hotel,Panoramic Beach View Culebra APT,"Beautiful apartment in Condominium Bahía Marina 1 with a lovely visit in Bahía Fulladosa. The apartment has a beautiful and spacious balcony with a view of the sea and the countryside. The apartment has one bedroom and two full bathrooms. A kitchen and living area. Fully furnished, all new. In the room, it has a queen bed and a bunk bed. So the total quota is six people. A tranquil and peaceful place.","250 Fulladoza Road, Playa Sardinas II",Culebra,Culebra & Vieques,775,USA,(787) 235-3464,https://coquibeachhomepr.com,N/A
496,https://www.discoverpuertorico.com/profile/salty-front/15986,Hotel,Salty Front,"Salty Front: Spectacular Ocean Front Apartment: Beautiful oceanfront apartment with a spectacular view and surfing spot, 13-minute walk / 3-minute drive to Mar Bella Beach, also known as Puerto Nuevo Beach, one of few beaches in the world awarded with the Blue Flag Certification. Unforgettable sunrise, sunset, beautiful day/ night skies, therapeutic waves sound, cruises and boats navigating day/night through the Atlantic Ocean, among other nature offerings that you will enjoy from our breezy balcony.",PR 692 Km. 1.2,Vega Baja,North,693,USA,(787) 413-3550,https://www.airbnb.com/rooms/54209573?source_impression_id=p3_1681498748_G3G2Qcv9xg81iqYt,"https://www.google.com/maps/search/?api=1&query=18.4880660000,-66.3914987000"
497,https://www.discoverpuertorico.com/profile/la-hacienda-beach-house/16032,Hotel,La Hacienda Beach House,"This comfortable, elegant brand-new remodeled home is the perfect short-term rental in Puerto Rico for those who appreciate having more privacy, personal space, and conveniences. A beautiful open floor plan that offers a comfortable, luxurious experience with excellent beds, a huge kitchen, and a lovely pool to swim and take in the sun! A large expansive living room gives you a grand feeling of relaxation. All this just in front of the Balneario Tres Hermanos: a beautiful, secluded, picturesque, and serene beach.","18.28856,-67.1939669",Añasco,West,610,USA,(787) 645-1208,https://airbnb.com/h/haciendabeachhouse,"https://www.google.com/maps/search/?api=1&query_place_id=https://www.google.com/maps/place/La+Hacienda+Beach+House/@18.28856,-67.1939669,17z/data=!3m1!4b1!4m6!3m5!1s0x8c02afa696c30091:0x7229f5cc9b308325!8m2!3d18.2885549!4d-67.1913866!16s%2Fg%2F11ptylg823?authuser=3&query=18.2846590000,-67.1899627000"
498,https://www.discoverpuertorico.com/profile/casa-garito/16066,Hotel,Casa Garito,"Casa Garito results from a legacy built around family, unity, and love. This unique place has an Open-Air Home concept, creating an indoor-outdoor relationship with the surrounding nature. The property has a Pet-Friendly room, entertainment and bar area, ample parking space for cars and watercraft like boats or jet skis, and a convenient cleaning area. All in all, this is a perfect option for a large family or friends vacation. Our space features the following facilities:","Carr. 324 KM. 0.1 Calle #1, Lote 6",Lajas,West,667,USA,(787) 379-6529,https://www.facebook.com/CasaGarito.LaParguera/,"https://www.google.com/maps/search/?api=1&query_place_id=ChIJk-c4iLBJHYwR0mm0C0w5ZlA&query=18.0499620000,-67.0593449000"
499,https://www.discoverpuertorico.com/profile/hotel-vista-bahia/16115,Hotel,Hotel Vista Bahia,A new all-inclusive property located in Salinas.,"Playita Final, 296 Cll A, Aguirre",Salinas,South,751,USA,(787) 254-1249,,"https://www.google.com/maps/search/?api=1&query=17.9605223000,-66.2896126000"
500,https://www.discoverpuertorico.com/profile/hibird-hotel/16117,Hotel,HiBird Hotel,"Welcome to HiBird Apartment and Suites, an independent hotel located in the heart of Condado! Our prime location and comfortable, beautifully designed apartments make us the perfect choice for your stay in PR. In addition to our stylish accommodations, we offer a range of amenities to enhance your stay. Take a dip in our pool, work up a sweat in our gym, or take a short walk to our dedicated beach area. Our on-site restaurant Pure Fresh Food and Juice Bar, offers delicious options for breakfast, lunch, and dinner, and our grab-and-go selection is perfect for those on the go.",1112 Av. Ashford,San Juan,Metro,907,USA,(939) 439-7777,https://stayhibird.com/,"https://www.google.com/maps/search/?api=1&query=18.4564059000,-66.0732869000"
501,https://www.discoverpuertorico.com/profile/comfort-inn-suites/16153,Hotel,Comfort Inn & Suites,"The Comfort Inn in San Juan is located minutes from Old San Juan, El Morro, Casa Bacardi, the Cathedral of San Juan, the International Airport.",#6 Calle Clemenceau,San Juan,Metro,907,USA,(787) 462-5362,,"https://www.google.com/maps/search/?api=1&query=18.4568079000,-66.0753342000"
503,https://www.discoverpuertorico.com/profile/serenity-breeze-beach-house/16364,Hotel,Serenity Breeze Beach House,"A waterfront beach house with stunning views and breathtaking sunsets. If you like simple yet beautiful, this is the place for you. It’s the perfect spot for your vacation or weekend getaway. Centrally located at Joyuda Beach, Cabo Rojo, close to restaurants, supermarkets, gas stations, and golf courses. Perfect for snorkeling, kayaking, paddle boarding (included with your rental), fishing, or just relaxing as you escape from the hustle.",PR-102 km. 14 H6,Cabo Rojo,West,623,USA,(787) 633-7252,https://www.airbnb.com/rooms/873233906984493048?source_impression_id=p3_1689882375_SD9jqAqtOR12SAiR,"https://www.google.com/maps/search/?api=1&query_place_id=ChIJr2uYk9xNHYwR36tHQWkdewc&query=18.0881809000,-67.1467167000"
504,https://www.discoverpuertorico.com/profile/charlies-house/16380,Hotel,Charlie's House,"Charlie Guest House, where each space has been designed to make you feel at home. Have fun in the pool, relax in the garden, and rest in one of the two incredible bedrooms. Excellent location in residential area with all kinds of shops on foot. - Private Pool -2 bedroom with 60 ""Smart TV, A/C and 2 full bathrooms - Fully equipped kitchen - Outdoor grill - Free parking -Fast Wi-Fi The space Room layout: Bedroom 1- Queen bed with private bathroom Bedroom 2- 1 Queen bed and individual bedroom.",comunidad corrales calle esmeralda 191,Aguadilla,West,603,USA,(774) 305-2762,https://www.airbnb.com/rooms/823932157414993000?source_impression_id=p3_1689882128_2lB9K7sTgdQ3Ccu3,"https://www.google.com/maps/search/?api=1&query=18.4451604000,-67.1282723000"
505,https://www.discoverpuertorico.com/profile/my-west-little-corner-apt/16445,Hotel,My West Little Corner Apt,"My West Little Corner Apt. with easy access to the city center, including museums and emblematic places in Mayagüez and where you can enjoy nightlife and first-class cuisine. We are in a very quiet and typical community. Discover the city from this homey and charming apartment. Excellent for businessmen and women who come to our town to do business. Relax and feel at home after a day of work or fun enjoying local channels or connecting to free Wi-Fi on our 50-inch TV. Book now!",Carr. 106 Km 4.2 Bo. Quemado,Mayagüez,West,680,USA,7879625894,http://airbnb.com/h/my-west-little-corner-apt2-explore,"https://www.google.com/maps/search/?api=1&query_place_id=https://maps.app.goo.gl/X89Sv6KiRy23ePAP8&query=18.2108234000,-67.0910451000"
