Index,URL,Type,Name,Description,Street Address,City,Region,Postal Code,Country,Telephone,Website,Google Maps URL
301,https://www.discoverpuertorico.com/profile/wyndham-palmas-beach-golf-resort/1938,Hotel,Wyndham Palmas Beach & Golf Resort,"Escape to Humacao’s beautiful resort community of Palmas del Mar for a relaxing stay at the contemporary Wyndham Palmas Beach & Golf Resort. Offering all-inclusive and room-only options, our non-smoking hotel is ideal for vacation and business travelers. Go for a refreshing swim in two outdoor pools, indulge in Puerto Rican cuisine and Caribbean cocktails at eight restaurants and bars, and retreat to spacious accommodations appointed with everything you need.",170 Candelero Dr.,Humacao,East,791,USA,(787) 247-7979,http://www.wyndhampalmas.com,"https://www.google.com/maps/search/?api=1&query=18.0888188000,-65.7970474000"
302,https://www.discoverpuertorico.com/profile/hotel-parador-banos-de-coamo/1965,Hotel,Hotel Parador Baños de Coamo,Coamo Hot Springs are open. Recorded Temporarily Closed - 20/11/2018,Carr. 546,Coamo,South,769,USA,(787) 825-2186,,"https://www.google.com/maps/search/?api=1&query_place_id=ChIJo_sCptTMHIwRlFp-z8jlv6c&query=18.0467462000,-66.3636299000"
303,https://www.discoverpuertorico.com/profile/casa-grande-mountain-retreat/2224,Hotel,Casa Grande Mountain Retreat,"Set in a stunning valley on 105 lush tropical acres, Casa Grande Mountain Retreat is an oasis of peace and tranquility. The former coffee plantation, now exquisitely landscaped, has 20 rooms scattered up the mountainside with a beautiful river as the lower border. Each room has its own en-suite bathroom, private porch, and hammock. A salt-water swimming pool is cradled beneath a green mountain vista. A fully equipped yoga center is used for individual and group practice. The restaurant serves fresh farm-to-table cuisine.",PR-612,Utuado,Central Mountains,641,USA,(787) 702-3156,https://casagrandepr.com/,"https://www.google.com/maps/search/?api=1&query_place_id=ChIJdeQuYfXYAowRs-Ck1E36AvM&query=18.2833545000,-66.6417763000"
306,https://www.discoverpuertorico.com/profile/seagate-hotel/10145,Hotel,SeaGate Hotel,"For over 40 years, the award-winning SeaGate Hotel has been a beautiful, eclectic refuge in the country. SeaGate overlooks the ocean and surrounding hills & treetops of Vieques which includes views of the historic Fort Conde de Mirasol. SeaGate Hotel is truly a unique space, with no two rooms exactly alike. Notable features are air-conditioning, kitchenettes (select rooms), patios/balconies & ocean views. We provide WiFi access & a knowledgeablefriendly staff. We provide expert advice on where to go & what to do in Vieques.",Ruta 989 Km .04 Bda Fuerte,Vieques,Culebra & Vieques,765,USA,(201) 450-8238,http://www.seagatehotel.com,"https://www.google.com/maps/search/?api=1&query_place_id=ChIJ_____6_HBIwRy2YK7i_7GQo&query=18.1472431000,-65.4398471000"
307,https://www.discoverpuertorico.com/profile/parador-villa-parguera/10196,Hotel,Parador Villa Parguera,"Parador Villa Parguera is one of the most complete and attractive parador (country inn) in Puerto Rico. Its beautiful and comfortable rooms, of which many have a balcony bordered by the imposing Caribbean Sea, blend into the patio between tropical palm trees and gardens that give a natural enchantment to our Parador.",PR 304 Km. 3.3 La Parguera,Lajas,West,667,USA,(787) 899-7777,https://www.villaparguerapr.com/,"https://www.google.com/maps/search/?api=1&query=17.9738287000,-67.0499317000"
308,https://www.discoverpuertorico.com/profile/4-casitas-bed-breakfast/10271,Hotel,4 Casitas Bed and Breakfast,4 Casitas is nestled in the foothills on the southwest corner of Puerto Rico. It is a unique eco-friendly community consisting of four cottages (casitas) and the main farm house (casa) making it an ideal location for a relaxing vacation.,"Carretera 300, km 2.3, Bario Llanos Tuna, Sector La Capilla",Cabo Rojo,West,623,USA,(404) 822-4442,http://4casitas.com,"https://www.google.com/maps/search/?api=1&query_place_id=https://www.google.com/maps/place/4+Casitas/@18.0544226,-67.1344564,2198m/data=!3m1!1e3!4m14!1m5!8m4!1e3!2s109994632860052859060!3m1!1e1!3m7!1s0x8c1d4d9dfef9437d:0x4bef317d60996300!5m2!4m1!1i2!8m2!3d18.0493475!4d-67.1281412&query=18.0493883000,-67.1280064000"
309,https://www.discoverpuertorico.com/profile/parador-el-faro/10289,Hotel,Parador El Faro,"Parador El Faro, a 75 room and a 16-acre estate feet opened in 1991 as an independent inn in Aguadilla, Puerto Rico. Parador El Faro amenities include two outdoor swimming pools and an on-site restaurant that offers a Puerto Rican and international style cuisine. If you are a dog lover, you are in luck; Parador el Faro is the only dog-friendly hotel managed by IHP Hospitality. The hotel is strategically located in the center of Aguadilla making it easy for guests to explore and discover the wonders that the West side of the island has to offer them.","4000 Av. Dr. Pedro Albizu Campos, Aguadilla Pueblo",Aguadilla,West,603,USA,(787) 882-8000,https://www.faroparador.com/es/index.html,"https://www.google.com/maps/search/?api=1&query_place_id=ChIJNYxA1w-9AowRvwv1hcjCkjI&query=18.4621996000,-67.1548134000"
310,https://www.discoverpuertorico.com/profile/hotel-lucia-beach/10382,Hotel,Hotel Lucía Beach,"Experience the essence of beachfront relaxation at Hotel Lucía Beach, a family- friendly hotel offering comfortable accommodations and affordable all-inclusive packages in southeast Puerto Rico. Our hotel is ideal for family travel, group trips, honeymoons or a variety of other seaside events.","Road 901 Int. 9911, Playa Lucía",Yabucoa,East,767,USA,(787) 705-8734,https://www.tropicalinnspr.com/,"https://www.google.com/maps/search/?api=1&query_place_id=ChIJQYIeuBWqBIwRDlK8Z_pUA1I&query=18.0397788000,-65.8353031000"
311,https://www.discoverpuertorico.com/profile/treasure-island-hotel-villas/10416,Hotel,Treasure Island Hotel & Villas,"Discover the history and the natural beauty at our historic hotel in the mountains of Cidra, Puerto Rico! Since 1930, we have been the perfect refuge for those seeking a unique natural experience. We have 20 rooms and 16 villas, each with its charm and character. We are surrounded by a beautiful lake, allowing you to enjoy stunning panoramic views from the comfort of your villa. We also offer kayaks so you can explore the lake and enjoy the serenity of the water.",200 Treasure Island,Cidra,Central Mountains,739,USA,(787) 714-3966,https://www.treasureislandhotelvillas.com/,"https://www.google.com/maps/search/?api=1&query_place_id=ChIJSdNECKlIA4wRNEwDpcMiQE8&query=18.1757914000,-66.1612779000"
312,https://www.discoverpuertorico.com/profile/olv-fifty-five/10452,Hotel,O:LV Fifty Five,"Standing out from the massive resorts, this adults-only hotel, O:LV Fifty Five is the new sister hotel (or more like its sleek, tall, handsome brother) of O:live Boutique Hotel. Located right between the Condado Lagoon and steps from the beach, and with loads of city swagger, O:LV Fifty Five is a sophisticated city tower styled from the ground up by design powerhouse responsible for winning The Best Design Hotel of the World and Best New Boutique Hotel by London’s Boutique Hotel Awards.",55 Barranquitas Street,San Juan,Metro,907,USA,(787) 705-9994,http://olvhotel.com/,"https://www.google.com/maps/search/?api=1&query_place_id=https://www.google.com/maps/place/O:LV+HOTEL/@18.45792,-66.0788287,17z/data=!3m1!4b1!4m9!3m8!1s0x8c036f3a2c52f9dd:0xb6e4fe78b03c4493!5m2!4m1!1i2!8m2!3d18.45792!4d-66.07664!16s%2Fg%2F11f54syl7g&query=18.4579262000,-66.0767217000"
313,https://www.discoverpuertorico.com/profile/parador-el-buen-cafe/10478,Hotel,Parador El Buen Café,"Located in Hatillo, Parador El Buen Café is in the city center. Arecibo Observatory and Arecibo Lighthouse are local landmarks, and the area's natural beauty can be seen at Rio Camuy Cave Park and Caño Tiburones Nature Reserve, minutes away from the Estatua de Cristobal Colón. Along with a restaurant, this smoke-free hotel has an outdoor pool and a business center. Free WiFi in public areas and free self-parking are also provided. Additionally, there's a conference space, a 24-hour front desk, and multilingual staff are onsite.","Carretera #2 Kilometro 84, #381",Hatillo,North,659,USA,(787) 898-1000,https://www.elbuencafepr.com,"https://www.google.com/maps/search/?api=1&query_place_id=ChIJO78IW27oAowR5axJbcSKI5s&query=18.4883443000,-66.7908508000"
314,https://www.discoverpuertorico.com/profile/posada-que-chevere-rincon/10486,Hotel,Posada Que Chévere Rincón!,"Qué Chévere Posada Hotel, located in a historic building right on the Plaza in the Center of Rincon, offers 11 individually decorated guest rooms with French balconies overlooking the Plaza or the hills/garden and two larger family suites. The goal of a Puerto Rican posada is to give visitors an opportunity to experience the culture, history and the architecture of the posada’s urban environment. It was with this in mind that the hotel was designed and decorated. Qué Chévere offers two room types.",#17 Muñoz Rivera St.,Rincón,West,00677-2182,USA,(787) 823-6452,http://quecheverepr.com/,"https://www.google.com/maps/search/?api=1&query=18.3394200000,-67.2506774000"
315,https://www.discoverpuertorico.com/profile/2-tiempos-ays-bed-breakfast/10489,Hotel,A 2 tiempos AyS Bed and Breakfast,"It gives us great pleasure to welcome you to our home, the National Historic Landmark, “Casa Jaime Acosta y Fores”. Enjoy at A 2 Tiempos Bed and Breakfast the unique experience of staying at a hundred-year-old architectural masterpiece. Each room boasts glorious hand-painted stencils, the only ones in existence in the Caribbean. We have furnished our home to the style of the era, giving the opportunity to relive the feeling of tranquility and quiet elegance of the 1900s.",#70 Calle Santiago Veve,San Germán,West,683,USA,(787) 476-1027,http://www.a2tempos.business.site,"https://www.google.com/maps/search/?api=1&query=18.0816510000,-67.0402268000"
316,https://www.discoverpuertorico.com/profile/casa-campo-bed-breakfast/10620,Hotel,Casa Campo Bed & Breakfast,"Located in San Sebastian, Puerto Rico, Casa Campo offers its guests a relaxing environment with all the amenities. Each room features a private balcony, refrigerator, microwave, free Wi-Fi, Internet TV and a spacious bathroom. Casa Campo features a complete fresh daily breakfast and unlimited access to the pool area where guest can relax under the sun. Guest can read books and watch TV in the lounge area or visit all the beaches and adventures that are near by. There is no other place like Casa Campo.",Urb. Pozas Hill Bo. Pozas,San Sebastián,West,685,USA,(787) 280-8638,http://www.casacampopr.com,"https://www.google.com/maps/search/?api=1&query=18.3423913000,-66.9914390000"
317,https://www.discoverpuertorico.com/profile/vieques-guesthouse/10637,Hotel,The Vieques Guesthouse,"The Vieques Guesthouse is a fun and relaxed 12-room guesthouse in Esperanza, featuring Caribbean Sea views, with close proximity to the Malecón and beaches (a 3- to 5-minute walk), eliminating the need for a rental car. We offer many different room types, from a standard room with one queen bed to a 2-bedroom apartment with a full kitchen. All of our rooms feature AC, new furniture/linens, mini-fridges, microwaves (two of our rooms have full kitchens), safes, fans, and 43"" TVs with 120+ satellite TV channels.",297 Calle Flamboyan,Vieques,Culebra & Vieques,00765-4009,USA,(787) 435-1513,http://www.theviequesguesthouse.com,"https://www.google.com/maps/search/?api=1&query=18.0957042000,-65.4751952000"
318,https://www.discoverpuertorico.com/profile/isla-hermosa-guesthouse/11374,Hotel,Isla Hermosa Guesthouse,"Quiet, private, just off the beaten path 4 room, 5 bed, guesthouse. Each room has its own private bathroom. Shared outdoor kitchen area and shared a living area with a TV and half bathroom.",12 Calle Destino,Vieques,Culebra & Vieques,765,USA,(845) 532-6643,https://www.islahermosaguesthouse.com/,"https://www.google.com/maps/search/?api=1&query=18.1334846000,-65.4326297000"
323,https://www.discoverpuertorico.com/profile/villa-ensenada/2385,Hotel,Villa Ensenada,"A little off the beaten path of Puerto Rico’s sunset coast, this stress-free oasis was created beside a beach that the locals have pretty much kept to themselves. Discover the pleasures of a relaxing place that you can call your home. Spend your evenings in your balcony sitting in a wicker chair and watching breath taking sunsets on another perfect day.",100 Carr 115,Rincón,West,677,USA,(787) 238-6422,https://www.rinconprrentals.com/property/9,"https://www.google.com/maps/search/?api=1&query_place_id=ChIJBTokQ7qlAowROtB5Y83JrhM&query=18.3449736000,-67.2493690000"
324,https://www.discoverpuertorico.com/profile/birdnest-studio/11252,Hotel,BirdNest Studio,"Birdnestudios are two well designed independent studios decorated to our tropical style. Colorful and spacious. We are perched on the side of a mountain on a 1-acre plot overlooking the Vieques channel and El Yunque mountains. We are near Vieques two main towns, Isabel ll, and Esperanza. We are also located 1 mile from the most popular beaches. We have a breath taking view and lots of tranquility. Our trade winds are always present and caring for our Nest. We have two units for your choice, Gaviota, sleeps 6 (two bedrooms 1 a/c) and Pitirre, a fully equipped studio, which sleeps 4.",Calle Loma Linda Lote 15-16,Vieques,Culebra & Vieques,765,USA,(787) 487-4244,https://birdnestudios.com/,"https://www.google.com/maps/search/?api=1&query_place_id=ChIJu4kGUaXHBIwRwm3TSzV_U7U&query=34.0483474000,-117.2611527000"
325,https://www.discoverpuertorico.com/profile/jardin-del-mar-guesthouse/11526,Hotel,Jardín del Mar Guesthouse,"Jardin del mar guesthouse, located at the coastal town of Hatillo. It offers an economic and accessible stay close to beaches, malls, stores, highways and tourist spots. The property is around 22.5 km from Arecibo Observatory, 24.1 km from Rio Camuy Cave Park and 12.9 km from Arecibo Lighthouse & Historical Park. Both private parking and free WiFi are accessible at the guesthouse. Complete with a private bathroom, the rooms at Jardin del Mar Guesthouse come with air conditioning, and certain rooms have a seating area.",Calle Jardin 833,Hatillo,North,659,USA,(787) 635-6491,,"https://www.google.com/maps/search/?api=1&query=18.4832270000,-66.7969260000"
326,https://www.discoverpuertorico.com/profile/san-sebastian-bed-breakfast/11528,Hotel,San Sebastián Bed & Breakfast,"San Sebastián Bed & Breakfast is a warm and quiet home run by a very hospitable family who is eager to share their lifestyle. This bed and breakfast is a clean, friendly, and welcoming place. The owners offer customized service, delicious daily breakfast, and travel guides to explore the town, which is full of history, museums, natural attractions, incredible views, and more. You can enjoy, within the property's walking distance, unique museums, local shops, restaurants, and a friendly environment.",Calle Andrés Méndez Liciaga #21,San Sebastián,West,685,USA,(787) 942-2867,https://www.facebook.com/ssbedandbreakfast/,"https://www.google.com/maps/search/?api=1&query_place_id=ChIJ5URx2oPHAowRQcwfjhruAGE&query=18.3375790000,-66.9906530000"
328,https://www.discoverpuertorico.com/profile/villa-larisa/11534,Hotel,Villa Larisa,"5 Bedroom ""Villa Larisa"" in Dorado Beach East: Seldom will you find a home more beautifully designed and exquisitely appointed than “Villa Larisa”, a 5-bedroom Vacation Paradise nestled on the beautiful Dorado Beach Resort and Club Property - one of the world’s finest tourist beach destinations. In “Villa Larisa” you’ll discover the style and genuine class firmly positioned at the top end of the range of Villas we offer. It's perfect for those who also desire easy access to the beach, pools, water playground, dining, shopping and nightlife.",Dorado Beach Resort,Dorado,North,646,USA,(508) 740-4690,http://bit.ly/VillaLarisaPVV,"https://www.google.com/maps/search/?api=1&query=18.4753725000,-66.3004613000"
329,https://www.discoverpuertorico.com/profile/villa-legends/11535,Hotel,Villa Legends,"Washed by cool ocean breezes, 3-Bedroom “Villa Legends” is nestled on the beautiful Dorado Beach Resort and Club Property - one of the world’s finest tourist beach destinations. The design maximizes privacy, provides a tropical haven, all while residing in this sun-kissed, sandy-beach community. Living here is a tropical delight, perfect for those who desire easy access to the beach, dining, shopping and nightlife. Whichever way you look at it, this is Paradise. This distinctly tropical, 2-story, stand-alone, luxury Villa offers:",Dorado Beach Resort,Dorado,North,646,USA,(508) 740-4690,http://bit.ly/VillaLegends,"https://www.google.com/maps/search/?api=1&query=18.4753725000,-66.3004613000"
330,https://www.discoverpuertorico.com/profile/villa-loyda/11536,Hotel,Villa Loyda,"""Villa Loyda"" at Embassy Suites, Dorado. The origin of “Loyda” is “Queen of Beauty” (going back to Helen of Troy!) and “Villa Loyda” is indeed located in a community known for its beauty: The Dorado Del Mar Resort in Puerto Rico - also recognized for cleanliness and excellent security.",Dorado del Mar,Dorado,North,646,USA,(508) 740-4690,http://bit.ly/VillaLoyda,"https://www.google.com/maps/search/?api=1&query=18.4717992000,-66.2739058000"
331,https://www.discoverpuertorico.com/profile/villa-serena/11537,Hotel,Villa Serena,"Location! Location! Location! Luxurious three-story ""Villa Serena"" has “IT”!",Cerro Gordo,Vega Alta,North,692,USA,(508) 740-4690,http://bit.ly/VillaSerenaPVV,"https://www.google.com/maps/search/?api=1&query=18.4756754000,-66.3349008000"
332,https://www.discoverpuertorico.com/profile/villa-searenity/11538,Hotel,Villa Searenity,"5 Bedroom Villa Searenity in Dorado Beach East. A famous thespian once said: “What we are all looking for is happiness - and if we could achieve a little piece of that each day - they would be called moments of serenity.” Well, you’ve found it: “Villa Searenity” - an oasis of serenity in a chaotic world - and not for just a moment, but all day long!",Dorado Beach,Dorado,North,646,USA,(508) 740-4690,https://paradisevillapr.com/villas/5br-villa-searenity-at-dorado-beach-east/,"https://www.google.com/maps/search/?api=1&query=18.4753725000,-66.3004613000"
333,https://www.discoverpuertorico.com/profile/villa-coral-reef/11539,Hotel,Villa Coral Reef,"4-Bedroom ""Villa Coral Reef"": Located in a preferred destination for visitors to the Caribbean Islands. Exciting tropical architecture, uniquely beautiful beaches, and, of course, the internationally renown, vacation-destination town of Dorado; launch pad to the island’s celebrated attractions.",Dorado Reef,Dorado,North,646,USA,(508) 740-4690,http://bit.ly/VillaCoralReef,"https://www.google.com/maps/search/?api=1&query=18.4706140000,-66.3136480000"
334,https://www.discoverpuertorico.com/profile/villa-brisas-del-mar/11540,Hotel,Villa Brisas Del Mar,"""Villa Brisas del Mar"" at Embassy Suites: “Brisas Del Mar” means “Sea Breezes” which waft from the sea through this beautiful Villa which overlooks the Atlantic Ocean and is located in a community known for its beauty, cleanliness and security - the Embassy Suites Resort in Puerto Rico. Enjoy access to the resort beach and restaurants, coming home to your spacious and breezy ocean view villa.",Embassy Suites,Dorado,North,646,USA,(508) 740-4690,https://paradisevillapr.com/villas/2br-villa-brisas-del-mar-at-embassy-suites/,"https://www.google.com/maps/search/?api=1&query=38.8441240000,-104.8348860000"
335,https://www.discoverpuertorico.com/profile/villa-galtero/11541,Hotel,Villa Galtero,2BR Villa Galtero - Dorado Beach Resort. Experience the peace and tranquility of 3-Bedroom “Villa Galtero” - located at “The Greens” in the Community of The Dorado Beach Resort. This charming Villa is just a short walk to the resort’s “West Beach” where the sunsets over the Atlantic Ocean are amazing!,Dorado Beach Resort,Dorado,North,646,USA,(508) 740-4690,https://paradisevillapr.com/villas/2-br-villa-galtero-dorado-beach-resort/,"https://www.google.com/maps/search/?api=1&query=18.4753725000,-66.3004613000"
336,https://www.discoverpuertorico.com/profile/villa-aurora/11542,Hotel,Villa Aurora,"Aurora is a sunny, well designed, three-bedroom Villa located in the world-renown vacation destination of Dorado, Puerto Rico in the heart of the Dorado Beach Embassy Suites resort. From its balcony and patio, enjoy the spectacular panoramic view of the golden-sand beach ... just steps away.",Embassy Suites Dorado del Mar,Dorado,North,646,USA,(508) 740-4690,https://paradisevillapr.com/villas/3-br-villa-aurora-at-costa-dorada/,"https://www.google.com/maps/search/?api=1&query=18.4773310000,-66.2735813000"
337,https://www.discoverpuertorico.com/profile/villa-bella-mar/11543,Hotel,Villa Bella Mar,“Bella Mar” is Spanish for “Beautiful Ocean” and “Villa Bella Mar” unquestionably deserves the name because you’ll enjoy spectacular panoramic views of the golden-sand beach ... so close you’ll feel you could almost dive into the waves directly from your balcony! The community has its own large pool and toddler pool accessible 24/7.,Embassy Suites Dorado del Mar,Dorado,North,646,USA,(508) 740-4690,https://paradisevillapr.com/villas/3br-villa-bella-mar-at-costa-dorada/,"https://www.google.com/maps/search/?api=1&query=18.4773310000,-66.2735813000"
338,https://www.discoverpuertorico.com/profile/villa-granada/11544,Hotel,Villa Granada,"3 Bedroom “Villa Granada” at “The Greens” in the Community of the Dorado Beach Resort: Spectacular ocean views from a villa designed with families in mind. This Villa is the perfect setting for your getaway, furnished with all you need for a comfortable and convenient stay, while 24-hour security gives you peace of mind.",Dorado Beach Resort,Dorado,North,646,USA,(508) 740-4690,https://paradisevillapr.com/villas/3br-villa-granada-at-dorado-beach-resort/,"https://www.google.com/maps/search/?api=1&query=18.4753725000,-66.3004613000"
339,https://www.discoverpuertorico.com/profile/villa-arrecife/11545,Hotel,Villa Arrecife,"Villa Arrecife defines the magic of Dorado, Puerto Rico, one of tropical Puerto Rico’s most iconic beach resort towns. It is a 2-story, four-bedroom, luxury stand-alone beach house within the Dorado Reef community, adjacent to the Dorado Beach Resort. Enjoy a short walk or golf cart ride to the DR community tennis courts or to the sparkling pool and beach club, overlooking the ocean, and feel your worries melt away! There are championship golf courses nearby as well as world-class restaurants, spas, water sports facilities and shops catering to every taste and need.",Dorado Reef,Dorado,North,646,USA,(508) 740-4690,https://paradisevillapr.com/villas/4-br-villa-arrecife-at-dorado-reef/,"https://www.google.com/maps/search/?api=1&query=18.4706140000,-66.3136480000"
340,https://www.discoverpuertorico.com/profile/villa-galante/11546,Hotel,Villa Galante,"2-Bedroom ""Villa Galante"": The moments of happiness we enjoy often take us by surprise - and so it is with “Villa Galante” - a unique gem located at “The Greens” in the Community of the Dorado Beach Resort. You’ll be surprised at how close you are to fabulous beaches as well as a 5-star resort.",Dorado Beach Resort,Dorado,North,646,USA,(508) 740-4690,https://paradisevillapr.com/villas/2-br-villa-galante-at-dorado-beach/,"https://www.google.com/maps/search/?api=1&query=18.4753725000,-66.3004613000"
341,https://www.discoverpuertorico.com/profile/villa-gemma/11547,Hotel,Villa Gemma,"“Villa Gemma” is the result of luxury island living and serene relaxation, indoors and out - all within a few minutes’ walk to gorgeous white-sand beaches. The villa is located in the Dorado Beach Resort Community with breathtaking panoramas of blue ocean and sky, together with spacious living areas. Ground floor entry one story, 2-Bedroom Vacation Paradise “Villa Gemma” - is fabulous in so many ways and offers:",Dorado Beach Resort,Dorado,North,646,USA,(508) 740-4690,https://paradisevillapr.com/villas/2-br-villa-gemma-dorado-beach-resort/,"https://www.google.com/maps/search/?api=1&query=18.4753725000,-66.3004613000"
342,https://www.discoverpuertorico.com/profile/villa-fairways/11548,Hotel,Villa Fairways,"1-Bedroom ""Villa Fairways"" in Dorado Beach: You have reached Paradise! This one-bedroom, one-and-a-half-bathroom luxury Villa is located in the heart of the Dorado Beach Resort and Club property in Dorado Beach. The Villa is fully air-conditioned, has palm-tree landscaping, and is within walking distance of many conveniences – including the unique “Spa Botanica”. Get around in your own personal 4-seater golf cart as the entire resort covers 1,500 acres and includes miles of beautiful trails for golf cart exploring, biking, walking, or jogging.",Dorado Beach,Dorado,North,646,USA,(508) 740-4690,http://bit.ly/VillaFairways,"https://www.google.com/maps/search/?api=1&query=18.4753725000,-66.3004613000"
343,https://www.discoverpuertorico.com/profile/villa-fantasia/11549,Hotel,Villa Fantasía,3 BR Villa Fantasia at Dorado Beach. There is something about the Caribbean which drives many of us to relinquish all we know for the promise of a dream. Welcome to your dream -- your corner of Paradise -- your fantasy -- aptly named “Villa Fantasía”.,Dorado Beach Resort,Dorado,North,646,USA,(508) 740-4690,http://bit.ly/VillaFantasia,"https://www.google.com/maps/search/?api=1&query=18.4753725000,-66.3004613000"
